{
  "$schema": "https://json-schema.org/draft/2020-12/schema",
  "$id": "platform-manifest-v1.schema.json",
  "title": "SteamZero platform manifest v1",
  "type": "object",
  "additionalProperties": false,
  "required": [
    "schemaVersion",
    "id",
    "kind",
    "name",
    "shortName",
    "iconKey",
    "artworkAsset",
    "systems",
    "capabilities",
    "areas",
    "emulators",
    "media",
    "controls",
    "timing",
    "presets",
    "cloud"
  ],
  "properties": {
    "schemaVersion": {
      "const": 1
    },
    "id": {
      "type": "string",
      "pattern": "^[a-z][a-z0-9-]{0,62}$"
    },
    "kind": {
      "enum": [
        "emulated",
        "cloud"
      ]
    },
    "name": {
      "type": "string",
      "minLength": 1,
      "maxLength": 80
    },
    "shortName": {
      "type": "string",
      "minLength": 1,
      "maxLength": 32
    },
    "iconKey": {
      "type": "string",
      "pattern": "^[a-z][a-z0-9-]{0,62}$"
    },
    "artworkAsset": {
      "type": "string",
      "pattern": "^\\.\\./assets/[a-z0-9-]+\\.svg$"
    },
    "systems": {
      "type": "array",
      "minItems": 1,
      "maxItems": 16,
      "uniqueItems": true,
      "items": {
        "type": "string",
        "pattern": "^[a-z0-9][a-z0-9-]{0,62}$"
      }
    },
    "capabilities": {
      "type": "array",
      "minItems": 1,
      "maxItems": 32,
      "items": {
        "$ref": "#/$defs/capability"
      }
    },
    "areas": {
      "type": "array",
      "minItems": 1,
      "maxItems": 16,
      "items": {
        "$ref": "#/$defs/area"
      }
    },
    "emulators": {
      "type": "array",
      "maxItems": 16,
      "items": {
        "$ref": "#/$defs/emulator"
      }
    },
    "media": {
      "$ref": "#/$defs/media"
    },
    "controls": {
      "$ref": "#/$defs/controls"
    },
    "timing": {
      "$ref": "#/$defs/timing"
    },
    "presets": {
      "type": "array",
      "minItems": 1,
      "maxItems": 16,
      "items": {
        "$ref": "#/$defs/preset"
      }
    },
    "cloud": {
      "oneOf": [
        {
          "type": "null"
        },
        {
          "$ref": "#/$defs/cloud"
        }
      ]
    },
    "requirements": {
      "type": "array",
      "uniqueItems": true,
      "maxItems": 2,
      "items": {
        "enum": [
          "keys",
          "firmware"
        ]
      }
    },
    "gameContent": {
      "type": "array",
      "uniqueItems": true,
      "maxItems": 10,
      "items": {"$ref": "#/$defs/gameContent"}
    }
  },
  "$defs": {
    "gameContent": {
      "description": "Conteúdo de jogo que a plataforma gerencia (R2). O painel do jogo mostra só o declarado, com estado honesto.",
      "type": "object",
      "additionalProperties": false,
      "required": ["id", "label", "state", "detail"],
      "properties": {
        "id": {"enum": ["updates", "dlc", "mods", "cheats", "patches", "saves", "saveStates", "achievements", "hdPacks", "shaders"]},
        "label": {"type": "string", "minLength": 1, "maxLength": 80},
        "state": {"enum": ["ready", "planned", "unavailable"]},
        "detail": {"type": "string", "minLength": 1, "maxLength": 300}
      }
    },
    "action": {
      "type": "object",
      "additionalProperties": false,
      "required": [
        "id",
        "label",
        "requiresConfirmation"
      ],
      "properties": {
        "id": {
          "type": "string",
          "pattern": "^[a-z][a-zA-Z0-9.:-]*$"
        },
        "label": {
          "type": "string",
          "minLength": 1,
          "maxLength": 80
        },
        "requiresConfirmation": {
          "type": "boolean"
        }
      }
    },
    "capability": {
      "type": "object",
      "additionalProperties": false,
      "required": [
        "id",
        "label",
        "state",
        "detail",
        "action"
      ],
      "properties": {
        "id": {
          "type": "string",
          "pattern": "^[a-z][a-z0-9.-]{0,62}$"
        },
        "label": {
          "type": "string",
          "minLength": 1,
          "maxLength": 80
        },
        "state": {
          "enum": [
            "ready",
            "planned",
            "unavailable"
          ]
        },
        "detail": {
          "type": "string",
          "minLength": 1,
          "maxLength": 300
        },
        "action": {
          "oneOf": [
            {
              "type": "null"
            },
            {
              "$ref": "#/$defs/action"
            }
          ]
        }
      }
    },
    "area": {
      "type": "object",
      "additionalProperties": false,
      "required": [
        "id",
        "label",
        "iconKey",
        "capabilityId"
      ],
      "properties": {
        "id": {
          "enum": [
            "overview",
            "keysFirmware",
            "updatesDlc",
            "modsCheats",
            "graphicsPerformance",
            "controls",
            "saves",
            "shaderCache",
            "media",
            "storage",
            "advanced"
          ]
        },
        "label": {
          "type": "string",
          "minLength": 1,
          "maxLength": 80
        },
        "iconKey": {
          "type": "string",
          "minLength": 1,
          "maxLength": 64
        },
        "capabilityId": {
          "type": "string",
          "pattern": "^[a-z][a-z0-9.-]{0,62}$"
        }
      }
    },
    "emulator": {
      "type": "object",
      "additionalProperties": false,
      "required": [
        "id",
        "name",
        "adapterId",
        "precedence",
        "role"
      ],
      "properties": {
        "id": {
          "type": "string",
          "pattern": "^[a-z][a-z0-9-]{0,62}$"
        },
        "name": {
          "type": "string",
          "minLength": 1,
          "maxLength": 80
        },
        "adapterId": {
          "type": [
            "string",
            "null"
          ],
          "pattern": "^[a-z][a-z0-9-]{0,62}$"
        },
        "precedence": {
          "type": "integer",
          "minimum": 1,
          "maximum": 100
        },
        "role": {
          "enum": [
            "primary",
            "fallback",
            "multi-system"
          ]
        },
        "launch": {
          "type": "object",
          "additionalProperties": false,
          "description": "Contrato de lançamento desta plataforma NESTE emulador. Fechado de propósito: sem comando livre, sem template textual, sem shell. O modo de execução deriva da fonte fixada do adapter, não de string do manifesto.",
          "required": [
            "gameArgs"
          ],
          "properties": {
            "core": {
              "type": "string",
              "pattern": "^[a-z0-9][a-z0-9_]*$",
              "description": "Core libretro exigido por esta plataforma. Um mesmo RetroArch instalado atende várias plataformas, cada uma com o seu core; a ausência do core é motivo legítimo para recusar Jogar."
            },
            "systemCores": {
              "type": "object",
              "maxProperties": 16,
              "propertyNames": {
                "pattern": "^[a-z0-9][a-z0-9-]{0,62}$"
              },
              "additionalProperties": {
                "type": "string",
                "pattern": "^[a-z0-9][a-z0-9_]*$"
              },
              "description": "Override de core por sistema declarado em systems. Quando o sistema não é identificado, core continua sendo o fallback explícito."
            },
            "openArgs": {
              "type": "array",
              "items": {
                "type": "string",
                "maxLength": 256
              },
              "maxItems": 16,
              "description": "Argumentos para abrir o emulador sem ROM."
            },
            "gameArgs": {
              "type": "array",
              "items": {
                "type": "string",
                "maxLength": 256
              },
              "minItems": 1,
              "maxItems": 16,
              "description": "Argumentos para lançar uma ROM. Placeholders allowlisted: {rom} para o caminho da ROM e {core} para o caminho do core resolvido. A ROM entra como argumento atômico, nunca concatenada."
            },
            "requiresBios": {
              "type": "array",
              "items": {
                "type": "string",
                "maxLength": 128
              },
              "maxItems": 32,
              "description": "Arquivos de BIOS exigidos, declarados por nome."
            }
          }
        }
      }
    },
    "media": {
      "type": "object",
      "additionalProperties": false,
      "required": [
        "extensions",
        "artworkKinds",
        "providers"
      ],
      "properties": {
        "extensions": {
          "type": "array",
          "maxItems": 32,
          "uniqueItems": true,
          "items": {
            "type": "string",
            "pattern": "^[a-z0-9]{1,12}$"
          }
        },
        "artworkKinds": {
          "type": "array",
          "minItems": 1,
          "uniqueItems": true,
          "items": {
            "enum": [
              "cover",
              "background",
              "logo",
              "icon",
              "video"
            ]
          }
        },
        "providers": {
          "type": "array",
          "uniqueItems": true,
          "items": {
            "type": "string",
            "pattern": "^[a-z0-9][a-z0-9-]{0,62}$"
          }
        },
        "formats": {
          "type": "object",
          "description": "Formato logico -> extensoes que o realizam, entre as extensoes declaradas. A presenca aqui define o que detect_format consegue nomear; extensao fora deste mapa tem formato nao declarado.",
          "additionalProperties": {
            "type": "array",
            "minItems": 1,
            "uniqueItems": true,
            "items": {
              "type": "string",
              "pattern": "^[a-z0-9]{1,12}$"
            }
          },
          "propertyNames": {
            "pattern": "^[a-z0-9][a-z0-9-]{0,15}$"
          }
        },
        "directoryFormats": {
          "type": "array",
          "uniqueItems": true,
          "items": {
            "type": "string",
            "pattern": "^[a-z0-9][a-z0-9-]{0,31}$"
          },
          "description": "Estruturas de diretório de jogo que o scanner reconhece sem promover seus arquivos internos."
        },
        "preferredFormat": {
          "type": "string",
          "pattern": "^[a-z0-9][a-z0-9-]{0,15}$",
          "description": "Formato preferido da biblioteca quando o mesmo titulo existe em varios formatos declarados."
        },
        "conversionTargets": {
          "type": "array",
          "uniqueItems": true,
          "items": {
            "type": "string",
            "pattern": "^[a-z0-9]{1,12}$"
          },
          "description": "Formatos-alvo de conversao que a plataforma declara aceitar (ex.: chd para optica, rvz para disco Wii/GC, nsz para Switch)."
        },
        "containerPolicy": {
          "type": "string",
          "enum": [
            "native",
            "extract"
          ],
          "description": "native = o container (zip/7z) roda direto no emulador; extract = o conteudo precisa ser extraido antes do lancamento."
        },
        "multiDisc": {
          "type": "object",
          "additionalProperties": false,
          "required": [
            "enabled",
            "descriptor",
            "media",
            "filenamePatterns",
            "requiresContinuousSequence"
          ],
          "properties": {
            "enabled": {"type": "boolean"},
            "descriptor": {"const": "m3u"},
            "media": {
              "type": "array",
              "minItems": 1,
              "uniqueItems": true,
              "items": {"type": "string", "pattern": "^[a-z0-9]{1,12}$"}
            },
            "filenamePatterns": {
              "type": "array",
              "minItems": 1,
              "uniqueItems": true,
              "items": {
                "enum": ["disc", "disk", "cd", "side", "label", "role"]
              }
            },
            "requiresContinuousSequence": {"type": "boolean"},
            "allowSideLabels": {"type": "boolean"},
            "orderingModel": {
              "enum": ["ordinal", "ordinal-and-role", "role"]
            },
            "allowedDiscLabels": {
              "type": "array",
              "uniqueItems": true,
              "items": {"type": "string", "pattern": "^[a-z0-9]{1,12}$"}
            },
            "adapterPlaylistSupport": {
              "enum": ["proven", "unproven", "unsupported"]
            },
            "roleOrder": {
              "type": "array",
              "uniqueItems": true,
              "items": {
                "enum": ["system", "program", "data", "user", "opening", "ending", "boot", "install"]
              }
            },
            "archiveMemberPolicy": {
              "type": "object",
              "additionalProperties": false,
              "required": ["allowedFormats", "letterLabelsAreOrdinal"],
              "properties": {
                "allowedFormats": {
                  "type": "array",
                  "minItems": 1,
                  "uniqueItems": true,
                  "items": {"type": "string", "pattern": "^[a-z0-9]{1,12}$"}
                },
                "letterLabelsAreOrdinal": {"type": "boolean"}
              }
            }
          }
        },
        "auxiliaryContent": {
          "type": "string",
          "enum": [
            "none",
            "update",
            "dlc",
            "both"
          ],
          "description": "Modelo de conteudo auxiliar da plataforma. none declarado explicitamente e informacao, nao omissao."
        },
        "auxiliaryBinding": {
          "type": "string",
          "enum": [
            "titleid",
            "filename",
            "directory"
          ],
          "description": "Como o conteudo auxiliar se vincula ao titulo base: por Title ID, por marcador no nome do arquivo ou por diretorio dedicado. Relevante apenas com conteudo auxiliar."
        },
        "nature": {
          "type": "string",
          "enum": [
            "cartridge",
            "optical",
            "floppy",
            "tape",
            "digital",
            "hdd"
          ],
          "description": "Natureza da midia primaria da plataforma. Dirige o modelo de conteudo (multidisco so faz sentido para midia optica) e a prioridade de selecao entre formatos do mesmo titulo."
        }
      }
    },
    "controls": {
      "type": "object",
      "additionalProperties": false,
      "required": [
        "profiles",
        "maxPlayers",
        "specialized"
      ],
      "properties": {
        "profiles": {
          "type": "array",
          "minItems": 1,
          "uniqueItems": true,
          "items": {
            "type": "string",
            "pattern": "^[a-z0-9][a-z0-9-]{0,62}$"
          }
        },
        "maxPlayers": {
          "type": "integer",
          "minimum": 1,
          "maximum": 16
        },
        "specialized": {
          "type": "array",
          "uniqueItems": true,
          "items": {
            "type": "string",
            "pattern": "^[a-z0-9][a-z0-9-]{0,62}$"
          }
        }
      }
    },
    "timing": {
      "type": "object",
      "additionalProperties": false,
      "required": [
        "standards",
        "defaultStandard",
        "unknownFallback"
      ],
      "properties": {
        "standards": {
          "type": "array",
          "minItems": 1,
          "uniqueItems": true,
          "items": {
            "type": "string",
            "pattern": "^[a-z0-9][a-z0-9-]{0,62}$"
          }
        },
        "defaultStandard": {
          "type": [
            "string",
            "null"
          ],
          "maxLength": 63
        },
        "unknownFallback": {
          "const": "unknown-explicit"
        }
      }
    },
    "preset": {
      "type": "object",
      "additionalProperties": false,
      "required": [
        "id",
        "label",
        "state",
        "detail"
      ],
      "properties": {
        "id": {
          "type": "string",
          "pattern": "^[a-z][a-z0-9-]{0,62}$"
        },
        "label": {
          "type": "string",
          "minLength": 1,
          "maxLength": 80
        },
        "state": {
          "enum": [
            "ready",
            "planned",
            "unavailable"
          ]
        },
        "detail": {
          "type": "string",
          "minLength": 1,
          "maxLength": 300
        }
      }
    },
    "cloud": {
      "type": "object",
      "additionalProperties": false,
      "required": [
        "launchUrl",
        "allowedHosts",
        "requiresSubscription"
      ],
      "properties": {
        "launchUrl": {
          "type": "string",
          "pattern": "^https://[^/]+/?"
        },
        "allowedHosts": {
          "type": "array",
          "minItems": 1,
          "maxItems": 8,
          "uniqueItems": true,
          "items": {
            "type": "string",
            "pattern": "^[a-z0-9.-]+$"
          }
        },
        "requiresSubscription": {
          "type": "boolean"
        }
      }
    }
  }
}
