{
  "schemaVersion": 1,
  "id": "nes-famicom",
  "kind": "emulated",
  "name": "Nintendo Entertainment System e Famicom",
  "shortName": "NES · Famicom",
  "iconKey": "input-gaming",
  "artworkAsset": "../assets/nes-famicom.svg",
  "systems": [
    "nes",
    "famicom"
  ],
  "capabilities": [
    {
      "id": "overview",
      "label": "Visão geral",
      "state": "planned",
      "detail": "Biblioteca NES/Famicom ainda será composta.",
      "action": null
    },
    {
      "id": "graphics",
      "label": "Vídeo e timing",
      "state": "planned",
      "detail": "PAR, NTSC/PAL e RF→RGB pertencem ao track R.",
      "action": null
    },
    {
      "id": "controls",
      "label": "Controles",
      "state": "ready",
      "detail": "Perfil base reversível; Zapper e paddle permanecem no R6.",
      "action": {
        "id": "controls.profile.activate",
        "label": "Selecionar perfil",
        "requiresConfirmation": true
      }
    },
    {
      "id": "media",
      "label": "Mídia",
      "state": "planned",
      "detail": "Artwork será composto no A7/A12.",
      "action": null
    }
  ],
  "areas": [
    {
      "id": "overview",
      "label": "Visão geral",
      "iconKey": "dashboard",
      "capabilityId": "overview"
    },
    {
      "id": "graphicsPerformance",
      "label": "Vídeo e timing",
      "iconKey": "video-display",
      "capabilityId": "graphics"
    },
    {
      "id": "controls",
      "label": "Controles",
      "iconKey": "gamepad",
      "capabilityId": "controls"
    },
    {
      "id": "media",
      "label": "Mídia",
      "iconKey": "image",
      "capabilityId": "media"
    }
  ],
  "emulators": [
    {
      "id": "retroarch",
      "name": "RetroArch",
      "adapterId": "retroarch",
      "precedence": 1,
      "role": "multi-system",
      "launch": {
        "core": "mesen",
        "openArgs": [],
        "gameArgs": [
          "-L",
          "{core}",
          "{rom}"
        ]
      }
    }
  ],
  "media": {
    "extensions": [
      "nes",
      "fds",
      "unf",
      "zip"
    ],
    "artworkKinds": [
      "cover",
      "background",
      "logo",
      "icon"
    ],
    "providers": [
      "screenscraper",
      "steamgriddb"
    ],
    "nature": "cartridge",
    "formats": {
      "nes": [
        "nes"
      ],
      "fds": [
        "fds"
      ],
      "unf": [
        "unf"
      ]
    },
    "containerPolicy": "native",
    "auxiliaryContent": "none"
  },
  "controls": {
    "profiles": [
      "standard-gamepad"
    ],
    "maxPlayers": 4,
    "specialized": [
      "zapper",
      "paddle"
    ]
  },
  "timing": {
    "standards": [
      "ntsc",
      "pal"
    ],
    "defaultStandard": null,
    "unknownFallback": "unknown-explicit"
  },
  "presets": [
    {
      "id": "como-era",
      "label": "Como era",
      "state": "planned",
      "detail": "Saída histórica por região."
    },
    {
      "id": "equilibrado",
      "label": "Equilibrado",
      "state": "planned",
      "detail": "Nitidez sem alterar timing."
    },
    {
      "id": "melhorado",
      "label": "Melhorado",
      "state": "planned",
      "detail": "Aprimoramentos opt-in."
    }
  ],
  "cloud": null,
  "gameContent": [
    {
      "id": "patches",
      "label": "Patches",
      "state": "planned",
      "detail": "IPS/BPS/UPS por soft-patching do core, sem alterar a ROM original."
    },
    {
      "id": "cheats",
      "label": "Cheats",
      "state": "planned",
      "detail": "Cheats do core (Game Genie e códigos RAM) pelo RetroArch."
    },
    {
      "id": "saves",
      "label": "Saves",
      "state": "planned",
      "detail": "Backup e restauração da SRAM do jogo."
    },
    {
      "id": "saveStates",
      "label": "Save states",
      "state": "planned",
      "detail": "Estados salvos do RetroArch por jogo."
    },
    {
      "id": "achievements",
      "label": "RetroAchievements",
      "state": "planned",
      "detail": "Conquistas por hash do jogo; exige conta RetroAchievements."
    },
    {
      "id": "hdPacks",
      "label": "HD packs",
      "state": "planned",
      "detail": "Pacotes HD do Mesen por jogo."
    }
  ]
}
